{
  "schema_version": "launcher_service_graph.v1",
  "profile_id": "core-rehearsal-text-bubble-v0",
  "start_policy": {
    "duplicate_start": "join_active",
    "optional_absent": "continue_degraded"
  },
  "stop_policy": {
    "idempotent": true,
    "residue": "retain_fixed_state"
  },
  "services": [
    {
      "service_id": "openai_provider_broker",
      "public_readiness_id": null,
      "dependencies": [],
      "requirement": "required",
      "ownership": "owned",
      "legacy_profile_member": true,
      "start": { "adapter_id": "job_worker_service", "absent_behavior": "fail", "legacy_spec_ids": ["openai_provider_broker"] },
      "readiness": { "probe_id": "provider_broker_health", "success": "owned_identity_and_probe", "degraded_allowed": false },
      "ready_deadline_ms": 60000,
      "port": { "ownership": "owned", "port_mode": "manifest_default", "transport": "http", "loopback_port": 18786, "endpoint_ref": "provider_broker_http" },
      "stop": { "adapter_id": "job_worker_job_close", "graceful_timeout_ms": 10000, "escalation": "owned_only" }
    },
    {
      "service_id": "thought_core_api",
      "public_readiness_id": "thought_core_api",
      "dependencies": ["openai_provider_broker"],
      "requirement": "required",
      "ownership": "owned",
      "legacy_profile_member": true,
      "start": { "adapter_id": "job_worker_service", "absent_behavior": "fail", "legacy_spec_ids": ["thought_core_api"] },
      "readiness": { "probe_id": "thought_core_health", "success": "owned_identity_and_probe", "degraded_allowed": false },
      "ready_deadline_ms": 60000,
      "port": { "ownership": "owned", "port_mode": "manifest_default", "transport": "http", "loopback_port": 18787, "endpoint_ref": "thought_core_http" },
      "stop": { "adapter_id": "job_worker_job_close", "graceful_timeout_ms": 10000, "escalation": "owned_only" }
    },
    {
      "service_id": "thought_core_watcher",
      "public_readiness_id": "thought_core_watcher",
      "dependencies": ["thought_core_api"],
      "requirement": "required",
      "ownership": "owned",
      "legacy_profile_member": true,
      "start": { "adapter_id": "job_worker_service", "absent_behavior": "fail", "legacy_spec_ids": ["thought_core_watcher"] },
      "readiness": { "probe_id": "thought_core_watcher_status", "success": "module_status", "degraded_allowed": false },
      "ready_deadline_ms": 60000,
      "port": { "ownership": "none", "port_mode": "none", "transport": "none", "loopback_port": null, "endpoint_ref": null },
      "stop": { "adapter_id": "job_worker_job_close", "graceful_timeout_ms": 10000, "escalation": "owned_only" }
    },
    {
      "service_id": "aituber_kit",
      "public_readiness_id": "aituber_kit",
      "dependencies": ["thought_core_watcher"],
      "requirement": "required",
      "ownership": "owned",
      "legacy_profile_member": true,
      "start": { "adapter_id": "job_worker_service", "absent_behavior": "fail", "legacy_spec_ids": ["aituber_kit"] },
      "readiness": { "probe_id": "aituber_health", "success": "owned_identity_and_probe", "degraded_allowed": false },
      "ready_deadline_ms": 60000,
      "port": { "ownership": "owned", "port_mode": "manifest_default", "transport": "http", "loopback_port": 3000, "endpoint_ref": "aituber_http" },
      "stop": { "adapter_id": "job_worker_job_close", "graceful_timeout_ms": 10000, "escalation": "owned_only" }
    }
  ]
}
